url_id,index,lecture_name,professor_name,rate,semester,like,text
2100129,0,JAVA프로그래밍,안민정,100.0,20,0,싸강이라면 꿀 그 자체.코딩만 어느정도 할 줄 알고 강의만 대충 들어도 기말과제까지 어려울거없음.
2100129,1,JAVA프로그래밍,안민정,100.0,20,2,교수님 답변도 정말 친절하게 잘해주심정말정말 꿀강의 입니다 강의가 늦게 올라오는게 커버될정도로 꿀강의.마지막 GUI가 어렵긴한데 못할정도 아님 오히려 변별력 있어서 좋았다고 생각함마지막 과제가 너무 어려워서 못풀었다 하는사람은 마지막 과제 전까지 꿀강의에 취해 본인이 공부나 노력을 안한건 아닌지 가슴에 손을 얹고 생각해봐야함
2100129,2,JAVA프로그래밍,안민정,20.0,20,2,학점은잘줌 강의시간안지킴 캔슬팍스타일
2100129,3,JAVA프로그래밍,안민정,100.0,20,2,비대면 강의였음.진짜 꿀 중의 꿀강의였음 자바 쪽은 아예 배운 적 없었지만 수업 따라가기 어렵지 않았음 아니 애초에 어려운 걸 가르치진 않았음 정말 자바의 기초를 잡아주는 수업더 심화한 내용 배울 거라면은 따로 공부해야함 다른 후기들처럼 조금 업로드가 느리고 성적처리도 느렸지만 이거 들으면서 한번도 A+ 못 받겠다고 생각한 적 없었음 비대면이긴 했지만 이 수업 A+ 못 받았다면 그건 진짜 진짜 공부를 안했을 뿐더러 그냥 과제 투자할 1시간도 투자를 안했다고 보면 됨 역대급 꿀강의 물론 마지막부분에 GUI 나오면서 지금까지 했던 과제들보단 난이도가 조금은 있었지만 딱 그정도. 어렵지 않았음 오히려 교수님이 난이도를 줄였음 비대면 꿀빠세욥
2100129,4,JAVA프로그래밍,안민정,40.0,20,0,수업은 ppt를 그대로 읽어주는게 끝코로나 때문에 대면실습을 못해서 그런가 후반부로 갈수록 수업을 따라가기가 힘들었다그런데다가 학생과 소통없이 후반부 과제 난이도 급상승성적을 가르기 위해서 그러신건가 싶지만 이게 과연 옳은 것인지..+ 자기 맘대로 강의날짜 바꾸고 성적처리도 늦어요
2100129,5,JAVA프로그래밍,안민정,80.0,20,0,"가끔 강의 업로드가 느린 적 있음.최대한 블랙보드와 메일로 공지를 해주심.강의 내용에서 학생들의 과제에 대해 언급하면서 짧게 피드백 해줘서 좋음. 또한 학생들이 어려워하는 부분은 강의로 최대한 설명해주심.실습을 진행할 수 없어서, 교수님이 코드 디버깅하는 영상을 올려주심.중간, 기말 없이 매주 과제로 진행.과제가 마지막 2-3주차 빼고 난이도 있는 건 아니여서 나름 꿀 강의였다고 생각함.종강하고 과제 채점이 늦어져, 성적이 늦게 올라옴."
2100129,6,JAVA프로그래밍,안민정,40.0,20,0,처음들은 교수님인데 성실하지 못하시다.원래 월요일 수업인데 임의로 강의를 미룸...또한 과제 채점도 계속 미룬 나머지 아직까지 채점을 못해서 학점을 못올림
